{
  "$schema": "./codex.schema.json",
  "schemaVersion": 1,
  "harness": "codex",
  "coordinator": "ceo",
  "independentReviewer": "governor",
  "maxParallelLeaves": 3,
  "fallbackModes": [
    "native",
    "manual",
    "sequential"
  ],
  "runtimeEvidence": "pending",
  "agentMap": {
    "cto": "ast-cto",
    "pe": "ast-pe",
    "cpo": "ast-cpo",
    "cqo": "ast-cqo",
    "cmo": "ast-cmo",
    "cfo": "ast-cfo",
    "cdo": "ast-cdo",
    "cco": "ast-cco",
    "clo": "ast-clo",
    "cro": "ast-cro",
    "cso": "ast-cso",
    "coo": "ast-coo",
    "governor": "ast-governor"
  },
  "requiredMaxDepth": 2,
  "cleanClientReceipt": {
    "status": "pending",
    "configEnvironmentVariable": "CODEX_HOME",
    "receiptMustBindRepositoryRevision": true,
    "requiredChecks": [
      "fresh-codex-home",
      "agents-discovered",
      "orchestrator-semantic-trigger",
      "ceo-manager-leaf-dispatch-observed",
      "governor-independent-review-observed"
    ]
  },
  "managerAgentMap": {
    "cto": {
      "agent": "ast-cto",
      "requiredMaxDepth": 2,
      "maxConcurrentChildren": 2,
      "fallbackMode": "parent-flat",
      "delegates": {
        "frontend-developer": "ast-cto-frontend-developer",
        "backend-architect": "ast-cto-backend-architect",
        "ai-engineer": "ast-cto-ai-engineer",
        "devops-automator": "ast-cto-devops-automator",
        "security-engineer": "ast-cto-security-engineer",
        "rapid-prototyper": "ast-cto-rapid-prototyper",
        "senior-developer": "ast-cto-senior-developer",
        "mobile-app-builder": "ast-cto-mobile-app-builder",
        "data-engineer": "ast-cto-data-engineer",
        "technical-writer": "ast-cto-technical-writer",
        "autonomous-optimization-architect": "ast-cto-autonomous-optimization-architect",
        "embedded-firmware-engineer": "ast-cto-embedded-firmware-engineer",
        "pc-host-engineer": "ast-cto-pc-host-engineer",
        "mechanical-design-engineer": "ast-cto-mechanical-design-engineer",
        "embedded-linux-driver-engineer": "ast-cto-embedded-linux-driver-engineer",
        "fpga-digital-design-engineer": "ast-cto-fpga-digital-design-engineer",
        "iot-solution-architect": "ast-cto-iot-solution-architect",
        "network-engineer-china": "ast-cto-network-engineer-china",
        "incident-response-commander": "ast-cto-incident-response-commander",
        "threat-detection-engineer": "ast-cto-threat-detection-engineer",
        "solidity-smart-contract-engineer": "ast-cto-solidity-smart-contract-engineer",
        "wechat-mini-program-developer": "ast-cto-wechat-mini-program-developer"
      },
      "roleRefs": {
        "pe": "ast-pe"
      }
    },
    "cpo": {
      "agent": "ast-cpo",
      "requiredMaxDepth": 2,
      "maxConcurrentChildren": 2,
      "fallbackMode": "parent-flat",
      "delegates": {
        "ui-designer": "ast-cpo-ui-designer",
        "ux-researcher": "ast-cpo-ux-researcher",
        "ux-architect": "ast-cpo-ux-architect"
      },
      "roleRefs": {}
    },
    "cco": {
      "agent": "ast-cco",
      "requiredMaxDepth": 2,
      "maxConcurrentChildren": 2,
      "fallbackMode": "parent-flat",
      "delegates": {
        "xiaohongshu-operator": "ast-cco-xiaohongshu-operator",
        "douyin-strategist": "ast-cco-douyin-strategist",
        "wechat-operator": "ast-cco-wechat-operator",
        "bilibili-strategist": "ast-cco-bilibili-strategist",
        "short-video-editing-coach": "ast-cco-short-video-editing-coach",
        "weixin-channels-strategist": "ast-cco-weixin-channels-strategist",
        "knowledge-commerce-strategist": "ast-cco-knowledge-commerce-strategist",
        "xiaohongshu-specialist": "ast-cco-xiaohongshu-specialist",
        "wechat-official-account-manager": "ast-cco-wechat-official-account-manager",
        "zhihu-strategist": "ast-cco-zhihu-strategist",
        "twitter-engager": "ast-cco-twitter-engager",
        "instagram-curator": "ast-cco-instagram-curator",
        "reddit-community-operator": "ast-cco-reddit-community-operator",
        "video-optimization-specialist": "ast-cco-video-optimization-specialist",
        "growth-hacker": "ast-cco-growth-hacker",
        "seo-specialist": "ast-cco-seo-specialist",
        "ai-citation-strategist": "ast-cco-ai-citation-strategist",
        "prompt-engineer": "ast-cco-prompt-engineer",
        "content-illustration-planner": "ast-cco-content-illustration-planner"
      },
      "roleRefs": {}
    },
    "cfo": {
      "agent": "ast-cfo",
      "requiredMaxDepth": 2,
      "maxConcurrentChildren": 2,
      "fallbackMode": "parent-flat",
      "delegates": {
        "bookkeeper-controller": "ast-cfo-bookkeeper-controller",
        "fpa-analyst": "ast-cfo-fpa-analyst",
        "financial-forecaster": "ast-cfo-financial-forecaster",
        "financial-analyst": "ast-cfo-financial-analyst",
        "invoice-manager": "ast-cfo-invoice-manager",
        "tax-strategist": "ast-cfo-tax-strategist",
        "fraud-detector": "ast-cfo-fraud-detector",
        "pricing-analyst": "ast-cfo-pricing-analyst"
      },
      "roleRefs": {}
    },
    "cdo": {
      "agent": "ast-cdo",
      "requiredMaxDepth": 2,
      "maxConcurrentChildren": 2,
      "fallbackMode": "parent-flat",
      "delegates": {
        "ai-data-remediation-engineer": "ast-cdo-ai-data-remediation-engineer",
        "email-intelligence-engineer": "ast-cdo-email-intelligence-engineer",
        "data-consolidator": "ast-cdo-data-consolidator",
        "sales-data-extractor": "ast-cdo-sales-data-extractor",
        "identity-graph-operator": "ast-cdo-identity-graph-operator"
      },
      "roleRefs": {}
    },
    "cqo": {
      "agent": "ast-cqo",
      "requiredMaxDepth": 2,
      "maxConcurrentChildren": 2,
      "fallbackMode": "parent-flat",
      "delegates": {
        "investment-researcher": "ast-cqo-investment-researcher",
        "model-qa-specialist": "ast-cqo-model-qa-specialist",
        "experiment-tracker": "ast-cqo-experiment-tracker",
        "spatial-data-scientist": "ast-cqo-spatial-data-scientist"
      },
      "roleRefs": {}
    },
    "cmo": {
      "agent": "ast-cmo",
      "requiredMaxDepth": 2,
      "maxConcurrentChildren": 2,
      "fallbackMode": "parent-flat",
      "delegates": {
        "brand-guardian": "ast-cmo-brand-guardian",
        "china-market-localization-strategist": "ast-cmo-china-market-localization-strategist",
        "pr-communications-manager": "ast-cmo-pr-communications-manager",
        "email-strategist": "ast-cmo-email-strategist",
        "paid-social-strategist": "ast-cmo-paid-social-strategist",
        "ppc-strategist": "ast-cmo-ppc-strategist",
        "tracking-attribution-specialist": "ast-cmo-tracking-attribution-specialist"
      },
      "roleRefs": {}
    },
    "cro": {
      "agent": "ast-cro",
      "requiredMaxDepth": 2,
      "maxConcurrentChildren": 2,
      "fallbackMode": "parent-flat",
      "delegates": {
        "trend-researcher": "ast-cro-trend-researcher",
        "feedback-analyst": "ast-cro-feedback-analyst",
        "x-twitter-intelligence-analyst": "ast-cro-x-twitter-intelligence-analyst",
        "news-intelligence-officer": "ast-cro-news-intelligence-officer",
        "search-query-analyst": "ast-cro-search-query-analyst",
        "evidence-collector": "ast-cro-evidence-collector"
      },
      "roleRefs": {}
    },
    "cso": {
      "agent": "ast-cso",
      "requiredMaxDepth": 2,
      "maxConcurrentChildren": 2,
      "fallbackMode": "parent-flat",
      "delegates": {
        "discovery-coach": "ast-cso-discovery-coach",
        "outbound-strategist": "ast-cso-outbound-strategist",
        "sales-engineer": "ast-cso-sales-engineer",
        "deal-strategist": "ast-cso-deal-strategist",
        "proposal-strategist": "ast-cso-proposal-strategist",
        "pipeline-analyst": "ast-cso-pipeline-analyst",
        "customer-success-manager": "ast-cso-customer-success-manager",
        "account-strategist": "ast-cso-account-strategist"
      },
      "roleRefs": {}
    },
    "coo": {
      "agent": "ast-coo",
      "requiredMaxDepth": 2,
      "maxConcurrentChildren": 2,
      "fallbackMode": "parent-flat",
      "delegates": {
        "operations-manager": "ast-coo-operations-manager",
        "project-shepherd": "ast-coo-project-shepherd",
        "change-management-consultant": "ast-coo-change-management-consultant",
        "meeting-notes-specialist": "ast-coo-meeting-notes-specialist"
      },
      "roleRefs": {}
    },
    "clo": {
      "agent": "ast-clo",
      "requiredMaxDepth": 2,
      "maxConcurrentChildren": 2,
      "fallbackMode": "parent-flat",
      "delegates": {
        "contract-reviewer": "ast-clo-contract-reviewer",
        "legal-policy-writer": "ast-clo-legal-policy-writer",
        "data-privacy-officer": "ast-clo-data-privacy-officer",
        "legal-document-reviewer": "ast-clo-legal-document-reviewer",
        "ai-governance-policy-specialist": "ast-clo-ai-governance-policy-specialist",
        "healthcare-marketing-compliance": "ast-clo-healthcare-marketing-compliance"
      },
      "roleRefs": {}
    }
  }
}
